{
  "schema_version": "1.1.0",
  "source_name": "fictional-modbus",
  "scenario_id": "SCN_HEALTHY_01",
  "acquisition": {
    "source_kind": "SIMULATED",
    "source_name": "fictional-modbus",
    "origin_kind": "SIMULATED",
    "origin_transformer_id": null,
    "replay_run_id": null,
    "gateway_id": "H07-b41b39",
    "timestamp_origin": "SOURCE_SNAPSHOT",
    "timezone_status": "DECLARED_UTC",
    "field_units": {
      "phase_voltage_l1": "V",
      "phase_voltage_l2": "V",
      "phase_voltage_l3": "V",
      "current_l1": "A",
      "current_l2": "A",
      "current_l3": "A",
      "neutral_current": "A",
      "oil_temperature": "DEG_C",
      "winding_temperature": "STATUS",
      "ambient_temperature": "DEG_C",
      "oil_level": "percent",
      "oil_temp_alarm": "STATUS",
      "oil_temp_trip": "STATUS",
      "magnetic_oil_gauge_alarm": "STATUS",
      "active_power_total": "kW",
      "apparent_power_total": "kVA",
      "reactive_power_total": "kVAr",
      "energy_kwh": "kWh",
      "power_factor_l1": "1",
      "power_factor_l2": "1",
      "power_factor_l3": "1"
    },
    "field_verification": {
      "phase_voltage_l1": "SYNTHETIC",
      "phase_voltage_l2": "SYNTHETIC",
      "phase_voltage_l3": "SYNTHETIC",
      "current_l1": "SYNTHETIC",
      "current_l2": "SYNTHETIC",
      "current_l3": "SYNTHETIC",
      "neutral_current": "SYNTHETIC",
      "oil_temperature": "SYNTHETIC",
      "winding_temperature": "SYNTHETIC",
      "ambient_temperature": "SYNTHETIC",
      "oil_level": "SYNTHETIC",
      "oil_temp_alarm": "SYNTHETIC",
      "oil_temp_trip": "SYNTHETIC",
      "magnetic_oil_gauge_alarm": "SYNTHETIC",
      "active_power_total": "SYNTHETIC",
      "apparent_power_total": "SYNTHETIC",
      "reactive_power_total": "SYNTHETIC",
      "energy_kwh": "SYNTHETIC",
      "power_factor_l1": "SYNTHETIC",
      "power_factor_l2": "SYNTHETIC",
      "power_factor_l3": "SYNTHETIC"
    },
    "measurement_side": "LV",
    "map_version": "fictional-lv-v1",
    "snapshot_id": "7e4a97a7616599ebc0502c299e3080b302d0d6724f616efef0d2a5306264ea1c",
    "sequence": 0,
    "expected_interval_seconds": 5
  },
  "transformer_id": "H07-b41b39-01",
  "timestamp": "2026-10-10T07:38:37.245258Z",
  "phase_voltage_l1": 232.03,
  "phase_voltage_l2": 231.09,
  "phase_voltage_l3": 229.96,
  "current_l1": 20.71,
  "current_l2": 20.29,
  "current_l3": 20.55,
  "neutral_current": 0.084,
  "oil_temperature": 42.0,
  "winding_temperature": null,
  "ambient_temperature": 34.7,
  "oil_level": 85.2,
  "oil_temp_alarm": 0,
  "oil_temp_trip": 0,
  "magnetic_oil_gauge_alarm": 0,
  "active_power_total": 12.948,
  "apparent_power_total": 14.22,
  "reactive_power_total": 5.877,
  "energy_kwh": 0.0,
  "power_factor_l1": 0.881,
  "power_factor_l2": 0.9137,
  "power_factor_l3": 0.9376
}